user_input,retrieved_contexts,response,reference,faithfulness,context_recall,context_precision,answer_correctness
Apa tujuan dilakukannya Pemeriksaan terhadap Lembaga Penjaminan oleh Otoritas Jasa Keuangan?,"['OTORITAS JASA KEUANGAN  \nREPUBLIK INDONESIA \n \nSALINAN \nPERATURAN OTORITAS JASA KEUANGAN \nNOMOR 7/POJK.05/2014 \n \nTENTANG \nPEMERIKSAAN LEMBAGA PENJAMINAN \n \nDENGAN RAHMAT TUHAN YANG MAHA ESA \nDEWAN KOMISIONER OTORITAS JASA KEUANGAN, \n \n \nMenimbang : a. Bahwa dalam rangka efektivitas pelaksanaan \npembinaan dan pengawasan terhadap Lembaga \nPenjaminan,perlu dilakukan pemeriksaan terhadap \nLembaga Penjaminan guna meningkatkan kepatuhan \nterhadap ketentuan yang berlaku di bidang  Lembaga \nPenjaminan; \n  b. Bahwa berdasarkan pertimbangan sebagaimana \ndimaksud pada huruf a di atas, perlu  menetapkan \nPeraturan Otoritas Jasa Keuangan tentang \nPemeriksaan Lembaga Penjaminan; \nMengingat : 1. Undang-Undang Nomor 21 Tahun 2011 tentang \nOtoritas Jasa Keuangan (Lembaran Negara Republik \nIndonesia Tahun 2011 Nomor 111, Tambahan \nLembaran Negara Republik Indonesia Nomor 5253); \n  2. Peraturan Presiden Nomor 2 Tahun 2008  tentang \nLembaga Penjaminan; \n  MEMUTUSKAN \nMenetapkan : PERATURAN OTORITAS JASA KEUANGAN TENTANG  \nPEMERIKSAAN LEMBAGA PENJAMINAN \n \n  BAB I \nKETENTUAN UMUM \n  Pasal 1 \n  Dalam Peraturan Otoritas Jasa Keuangan ini yang \ndimaksud dengan:', '-3- \n \ndisampaikan kepada Lembaga Penjaminan yang akan  \ndiperiksa. \n  13. Otoritas Jasa Keuangan adalah lembaga yang \nindependen dan bebas dari campur tangan pihak lain \nyang mempunyai  fungsi, tugas  dan wewenang \npengaturan, pengawasan, pemeriksaan dan penyidikan \nsebagaimana dimaksud dalam Undang-Undang \nmengenai Otoritas Jasa Keuangan.      \n \n  BAB II \nPEMERIKSAAN \n  Pasal 2 \n  (1) Dalam rangka pelaksanaan fungsi pengawasan,  \nOtoritas Jasa Keuangan melakukan Pemeriksaan \nterhadap Lembaga Penjaminan.  \n  (2) Pemeriksaan bertujuan untuk: \na. Memperoleh keyakinan mengenai kondisi Lembaga \nPenjaminan yang sebenarnya; \nb. Meneliti kesesuaian kondisi Lembaga Penjaminan \ndengan peraturan perundang-undangan serta \nstandar, prinsip, dan  praktik penyelenggaraan \nusaha Penjaminan atau Penjaminan Ulang yang \nsehat; dan \nc. Memastikan bahwa Lembaga Penjaminan telah \nmelakukan upaya untuk dapat memenuhi \nkewajiban kepada Penerima Jaminan.    \n  Pasal 3 \n  (1) Pelaksanaan Pemeriksaan terhadap setiap Lembaga \nPenjaminan dilakukan: \na. secara berkala paling sedikit 1 ( satu) kali dalam 1 \n(satu) tahun; atau', 'PENJELASAN \nATAS \nPERATURAN OTORITAS JASA KEUANGAN \nNOMOR 7/POJK.05/2014 \nTENTANG  \nPEMERIKSAAN LEMBAGA PENJAMINAN \nI. UMUM \nLembaga Penjaminan adalah sebagai salah satu lembaga keuangan non \nbank yang diharapkan mampu untuk menjembatani akses UMKM pada \nfasilitas pembiayaan perbankan, sehingga diharapkan dengan tumbuhnya \nsektor UMKM dapat berdampak pada pertumbuhan ekonomi nasional. \nUntuk itu diperlukan pengelolaan kegiatan usaha yang efektif dan efisien \nyang dilaksanakan oleh Lembaga Penjaminan guna m ewujudkan tujuan \ndimaksud. Untuk memastikan adanya efektivitas dalam pengelolaan \nkegiatan usaha Lembaga Penjaminan termasuk kepatuhan terhadap \nketentuan yang berlaku, perlu dilakukan pengawasan yang bersifat on site \nsupervision dalam bentuk pemeriksaan langsung.   \nDengan telah disahkannya Undang-Undang Nomor 21 Tahun 2011 tentang \nOtoritas Jasa Keuangan pada tanggal 22 November 2011, maka tugas \npengawasan atas Lembaga Penjaminan  beralih kepada Otoritas Jasa \nKeuangan sejak tanggal 31 Desember 2012 , tentunya dibutuhkan landasan \nhukum bagi Otoritas Jasa Keuangan dalam menjalankan fungsi dan \nkewenangannya dalam mengawasi Lembaga Penjaminan dalam bentuk']","Pemeriksaan bertujuan untuk memperoleh keyakinan mengenai kondisi Lembaga Penjaminan yang sebenarnya, meneliti kesesuaian kondisi dengan peraturan perundang-undangan serta standar, prinsip, dan praktik penyelenggaraan usaha Penjaminan atau Penjaminan Ulang yang sehat, dan memastikan Lembaga Penjaminan telah melakukan upaya untuk memenuhi kewajiban kepada Penerima Jaminan.","Pemeriksaan bertujuan untuk memperoleh keyakinan mengenai kondisi Lembaga Penjaminan yang sebenarnya, meneliti kesesuaian kondisi dengan peraturan perundang-undangan dan praktik yang sehat, serta memastikan bahwa Lembaga Penjaminan telah melakukan upaya pemenuhan kewajiban kepada Penerima Jaminan.",1.0,1.0,0.99999999995,0.8894508204874358
Berapa kali sekurang-kurangnya pemeriksaan berkala dilakukan terhadap Lembaga Penjaminan dalam satu tahun?,"['a. secara berkala paling sedikit 1 ( satu) kali dalam 1 \n(satu) tahun; atau  \nb. setiap waktu bila diperlukan.   \n  (2) Pemeriksaan berkala sebagaimana dimaksud pada \nayat (1) meliputi pemeriksaan atas substansi laporan \nberkala dan kepatuhan terhadap peraturan \nperundang-undangan di bidang lembaga penjaminan. \n  (3) Pemeriksaan setiap waktu sebagaimana dimaksud \npada ayat (1) huruf b merupakan Pemeriksaan yang \nbersifat khusus dan dilakukan apabila: \na. berdasarkan hasil analisis atas laporan berkala \nLembaga   Penjaminan,     patut    diduga    bahwa  \n \n                                                   penyelenggaraan...', '-3- \n \ndisampaikan kepada Lembaga Penjaminan yang akan  \ndiperiksa. \n  13. Otoritas Jasa Keuangan adalah lembaga yang \nindependen dan bebas dari campur tangan pihak lain \nyang mempunyai  fungsi, tugas  dan wewenang \npengaturan, pengawasan, pemeriksaan dan penyidikan \nsebagaimana dimaksud dalam Undang-Undang \nmengenai Otoritas Jasa Keuangan.      \n \n  BAB II \nPEMERIKSAAN \n  Pasal 2 \n  (1) Dalam rangka pelaksanaan fungsi pengawasan,  \nOtoritas Jasa Keuangan melakukan Pemeriksaan \nterhadap Lembaga Penjaminan.  \n  (2) Pemeriksaan bertujuan untuk: \na. Memperoleh keyakinan mengenai kondisi Lembaga \nPenjaminan yang sebenarnya; \nb. Meneliti kesesuaian kondisi Lembaga Penjaminan \ndengan peraturan perundang-undangan serta \nstandar, prinsip, dan  praktik penyelenggaraan \nusaha Penjaminan atau Penjaminan Ulang yang \nsehat; dan \nc. Memastikan bahwa Lembaga Penjaminan telah \nmelakukan upaya untuk dapat memenuhi \nkewajiban kepada Penerima Jaminan.    \n  Pasal 3 \n  (1) Pelaksanaan Pemeriksaan terhadap setiap Lembaga \nPenjaminan dilakukan: \na. secara berkala paling sedikit 1 ( satu) kali dalam 1 \n(satu) tahun; atau', 'c. terdapat alasan khusus yang mendasari perlunya \ndilakukan Pemeriksaan, antara lain: \n1. verifikasi kegiatan operasional Lembaga \nPenjaminan;    \n2. penggabungan; \n3. peleburan; \n4. pengambilalihan; dan/atau \n5. pengalihan portofolio Penjaminan atau \nPenjaminan Ulang. \n  (4) Pemeriksaan sebagaimana dimaksud pada ayat (1) \ndimuat dalam rencana pemeriksaan tahunan yang \nditetapkan oleh OtoritasJasaKeuangan. \n  Pasal 4 \n  (1) Pemeriksaan sebagaimana dimaksud dalam Pasal 3 \ndilaksanakan oleh Pemeriksa berdasarkan Surat \nPerintah Pemeriksaan dan Surat Pemberitahuan \nPemeriksaan.  \n  (2) Sebelum dilakukan Pemeriksaan sebagaimana \ndimaksud pada ayat (1) terlebih dahulu disampaikan \nSurat Pe mberitahuan Pemeriksaan kepada Lembaga \nPenjaminan.']",Pemeriksaan berkala dilakukan paling sedikit 1 (satu) kali dalam 1 (satu) tahun.,Pelaksanaan Pemeriksaan terhadap setiap Lembaga Penjaminan secara berkala dilakukan paling sedikit 1 (satu) kali dalam 1 (satu) tahun.,1.0,1.0,0.99999999995,0.9820215747110501
Bagaimana tahap Pemeriksaan Lembaga Penjaminan yang dilakukan oleh OJK?,"['c. terdapat alasan khusus yang mendasari perlunya \ndilakukan Pemeriksaan, antara lain: \n1. verifikasi kegiatan operasional Lembaga \nPenjaminan;    \n2. penggabungan; \n3. peleburan; \n4. pengambilalihan; dan/atau \n5. pengalihan portofolio Penjaminan atau \nPenjaminan Ulang. \n  (4) Pemeriksaan sebagaimana dimaksud pada ayat (1) \ndimuat dalam rencana pemeriksaan tahunan yang \nditetapkan oleh OtoritasJasaKeuangan. \n  Pasal 4 \n  (1) Pemeriksaan sebagaimana dimaksud dalam Pasal 3 \ndilaksanakan oleh Pemeriksa berdasarkan Surat \nPerintah Pemeriksaan dan Surat Pemberitahuan \nPemeriksaan.  \n  (2) Sebelum dilakukan Pemeriksaan sebagaimana \ndimaksud pada ayat (1) terlebih dahulu disampaikan \nSurat Pe mberitahuan Pemeriksaan kepada Lembaga \nPenjaminan.', 'PENJELASAN \nATAS \nPERATURAN OTORITAS JASA KEUANGAN \nNOMOR 7/POJK.05/2014 \nTENTANG  \nPEMERIKSAAN LEMBAGA PENJAMINAN \nI. UMUM \nLembaga Penjaminan adalah sebagai salah satu lembaga keuangan non \nbank yang diharapkan mampu untuk menjembatani akses UMKM pada \nfasilitas pembiayaan perbankan, sehingga diharapkan dengan tumbuhnya \nsektor UMKM dapat berdampak pada pertumbuhan ekonomi nasional. \nUntuk itu diperlukan pengelolaan kegiatan usaha yang efektif dan efisien \nyang dilaksanakan oleh Lembaga Penjaminan guna m ewujudkan tujuan \ndimaksud. Untuk memastikan adanya efektivitas dalam pengelolaan \nkegiatan usaha Lembaga Penjaminan termasuk kepatuhan terhadap \nketentuan yang berlaku, perlu dilakukan pengawasan yang bersifat on site \nsupervision dalam bentuk pemeriksaan langsung.   \nDengan telah disahkannya Undang-Undang Nomor 21 Tahun 2011 tentang \nOtoritas Jasa Keuangan pada tanggal 22 November 2011, maka tugas \npengawasan atas Lembaga Penjaminan  beralih kepada Otoritas Jasa \nKeuangan sejak tanggal 31 Desember 2012 , tentunya dibutuhkan landasan \nhukum bagi Otoritas Jasa Keuangan dalam menjalankan fungsi dan \nkewenangannya dalam mengawasi Lembaga Penjaminan dalam bentuk', '- 35 - \n \n(2) Pengawasan terhadap Perusahaan Pergadaian \ndilakukan berdasarkan Peraturan OJK ini dan \nperaturan pelaksanaannya. \n \nBagian Kedua \nPemeriksaan Perusahaan Pergadaian \n \nPasal 42 \n(1) Dalam rangka pelaksanaan fungsi pengawasan \nsebagaimana dimaksud dalam Pasal 41 ayat (1), OJK \nberwenang melakukan Pemeriksaan terhadap \nPerusahaan Pergadaian. \n(2) Pemeriksaan sebagaimana dimaksud pada ayat (1) \ndilakukan oleh tim Pemeriksa yang dapat terdiri dari: \na. pegawai OJK yang ditugaskan untuk melakukan \nPemeriksaan; \nb. pihak lain yang ditunjuk oleh OJK; atau \nc. gabungan antara pegawai OJK dan pihak lain \nyang ditunjuk oleh OJK. \n \nPasal 43 \nPelaksanaan Pemeriksaan terhadap setiap Perusahaan \nPergadaian dilakukan: \na. secara berkala sesuai dengan rencana Pemeriksaan \ntahunan yang ditetapkan oleh OJK; dan/atau \nb. setiap waktu bila diperlukan. \n \nPasal 44 \n(1) Pemeriksaan sebagaimana dimaksud dalam Pasal 43 \ndilaksanakan oleh Pemeriksa berdasarkan surat \nperintah Pemeriksaan dan surat pemberitahuan \nPemeriksaan. \n(2) Sebelum dilakukan Pemeriksaan sebagaimana \ndimaksud pada ayat (1) terlebih dahulu disampaikan \nsurat pemberitahuan Pemeriksaan kepada \nPerusahaan Pergadaian.']",Pemeriksaan Lembaga Penjaminan dilakukan berdasarkan Surat Perintah Pemeriksaan dan Surat Pemberitahuan Pemeriksaan yang terlebih dahulu disampaikan kepada Lembaga Penjaminan.,Pemeriksaan berkala meliputi pemeriksaan atas substansi laporan berkala dan kepatuhan terhadap peraturan perundang-undangan di bidang lembaga penjaminan.,1.0,0.0,0.0,0.2234974419254038
Berapa batas nominal terendah Pinjaman atau Pembiayaan yang wajib dilayani oleh Lembaga Keuangan Mikro (LKM)?,"['Pasal 5 \nLKM wajib mengumumkan suku bunga maksimum \nPinjaman atau imbal hasil maksimum Pembiayaan \nsebagaimana dimaksud dalam Pasal 4 melalui surat kabar \nharian lokal atau papan pengumuman di kantor LKM yang \nmudah diketahui oleh masyarakat.                  \nPasal 6 \n(1)  Batas Pinjaman atau Pembiayaan terendah yang dilayani \noleh LKM sebesar Rp50.000,- (lima puluh ribu Rupiah). \n(2) LKM dilarang menolak batas Pinjaman atau Pembiayaan \nterendah sebagaimana dimaksud pada ayat (1). \n \n        Pasal 7...', '-5- \n \nPasal 7 \n(1)  LKM setiap saat wajib memenuhi batas maksimum \npemberian Pinjaman atau Pembiayaan kepada setiap \nnasabah. \n(2) Batas maksimum pemberian Pinjaman atau Pembiayaan \nsebagaimana dimaksud pada ayat (1) ditetapkan sebagai \nberikut: \na. paling tinggi 10% (sepuluh persen) dari modal LKM \nuntuk nasabah kelompok; \nb. paling tinggi 5% (lima persen) dari modal LKM untuk \n1 (satu) nasabah.            \n(3) Modal LKM sebagaimana dimaksud pada ayat (2) \ndihitung dari: \na. penjumlahan dari modal disetor, tambahan modal \ndisetor, cadangan, hibah , dan saldo laba atau rug i \ndalam hal LKM berbentuk badan hukum perseroan \nterbatas; atau \nb. penjumlahan dari simpanan pokok, simpanan wajib, \ndana cadangan, hibah, dan sisa hasil usaha, dalam \nhal LKM berbentuk badan hukum koperasi.', 'Pasal 8 \n(1) LKM wajib melakukan penilaian kualitas Pinjaman atau \nPembiayaan yang disalurkan. \n(2) Penilaian kualitas Pinjaman atau Pembiayaan \nsebagaimana dimaksud pada ayat (1) ditetapkan menjadi \n3 (tiga) kelompok yaitu: \na. lancar; \nb. diragukan; dan \nc. macet. \n(3) Ketentuan mengenai parameter pengukuran kualitas \nPinjaman atau Pembiayaan  sebagaimana tercantum \ndalam Lampiran II I yang merupakan bagian yang tidak \nterpisahkan dari Peraturan OJK ini. \nPasal 9 \nLKM wajib membentuk penyisihan penghapusan Pinjaman \natau Pembiayaan paling kurang:  \na. 0%...']","Batas Pinjaman atau Pembiayaan terendah yang wajib dilayani oleh LKM adalah Rp50.000,- (lima puluh ribu Rupiah).","Batas Pinjaman atau Pembiayaan terendah yang dilayani oleh LKM adalah sebesar Rp50.000,- (lima puluh ribu Rupiah).",1.0,1.0,0.9999999999,0.9987540619643125
Berapa batas maksimum pemberian Pinjaman atau Pembiayaan Lembaga Keuangan Mikro (LKM) untuk nasabah kelompok?,"['-5- \n \nPasal 7 \n(1)  LKM setiap saat wajib memenuhi batas maksimum \npemberian Pinjaman atau Pembiayaan kepada setiap \nnasabah. \n(2) Batas maksimum pemberian Pinjaman atau Pembiayaan \nsebagaimana dimaksud pada ayat (1) ditetapkan sebagai \nberikut: \na. paling tinggi 10% (sepuluh persen) dari modal LKM \nuntuk nasabah kelompok; \nb. paling tinggi 5% (lima persen) dari modal LKM untuk \n1 (satu) nasabah.            \n(3) Modal LKM sebagaimana dimaksud pada ayat (2) \ndihitung dari: \na. penjumlahan dari modal disetor, tambahan modal \ndisetor, cadangan, hibah , dan saldo laba atau rug i \ndalam hal LKM berbentuk badan hukum perseroan \nterbatas; atau \nb. penjumlahan dari simpanan pokok, simpanan wajib, \ndana cadangan, hibah, dan sisa hasil usaha, dalam \nhal LKM berbentuk badan hukum koperasi.', 'Bagian Ketiga \nBatasan Pemberian Pinjaman Dana \n \nPasal 6 \n(1) Penyelenggara wajib memenuhi ketentuan batas \nmaksimum total pemberian pinjaman dana k epada \nsetiap Penerima Pinjaman.', 'Pasal 5 \nLKM wajib mengumumkan suku bunga maksimum \nPinjaman atau imbal hasil maksimum Pembiayaan \nsebagaimana dimaksud dalam Pasal 4 melalui surat kabar \nharian lokal atau papan pengumuman di kantor LKM yang \nmudah diketahui oleh masyarakat.                  \nPasal 6 \n(1)  Batas Pinjaman atau Pembiayaan terendah yang dilayani \noleh LKM sebesar Rp50.000,- (lima puluh ribu Rupiah). \n(2) LKM dilarang menolak batas Pinjaman atau Pembiayaan \nterendah sebagaimana dimaksud pada ayat (1). \n \n        Pasal 7...']",Batas maksimum pemberian Pinjaman atau Pembiayaan LKM untuk nasabah kelompok adalah paling tinggi 10% (sepuluh persen) dari modal LKM.,Batas maksimum pemberian Pinjaman atau Pembiayaan untuk nasabah kelompok ditetapkan paling tinggi 10% (sepuluh persen) dari modal LKM.,1.0,1.0,0.9999999999,0.9981724283399573
Dari mana saja sumber pendanaan Lembaga Keuangan Mikro (LKM) dapat berasal?,"['-2- \n \n1. Lembaga Keuangan Mikro yang selanjutnya disingkat \nLKM adalah lembaga keuangan yang khusus didirikan \nuntuk memberikan jasa pengembangan usaha dan \npemberdayaan masyarakat, baik melalui pinjaman atau \npembiayaan dalam usaha skala mikro kepada anggota \ndan masyarakat, pengelolaa n simpanan, maupun \npemberian jasa konsultasi pengembangan usaha yang \ntidak semata-mata mencari keuntungan. \n2. Pinjaman adalah penyediaan dana oleh LKM kepada \nmasyarakat yang harus dikembalikan sesuai dengan \nyang diperjanjikan. \n3. Pembiayaan adalah penyediaan dan a oleh LKM kepada \nmasyarakat yang harus dikembalikan sesuai dengan \nyang diperjanjikan dengan prinsip syariah. \n4. Simpanan adalah dana yang dipercayakan oleh \nmasyarakat kepada LKM dalam bentuk tabungan \ndan/atau deposito berdasarkan perjanjian penyimpanan \ndana. \n5. Penyimpan adalah pihak yang menempatkan dananya \npada LKM berdasarkan perjanjian. \n6. Prinsip Syariah adalah ketentuan hukum Islam \nberdasarkan fatwa atau pernyataan kesesuaian syariah \ndari Dewan Syariah Nasional Majelis Ulama Indonesia  \n(DSN MUI). \n7. Direksi:', 'Pasal 1 \nDalam Peraturan Otoritas Jasa Keuangan  ini yang \ndimaksud dengan: \n1. Lembaga Keuangan Mikro yang selanjutnya disingkat \nLKM adalah lembaga keuangan yang khusus didirikan \nuntuk memberikan jasa pengembangan usaha dan \npemberdayaan masyarakat, baik melalui pinjaman atau \npembiayaan dalam usaha skala mikro kepada anggota \ndan masyarakat, pengelolaan simpanan, maupun \npemberian jasa konsultasi pengembangan usaha yang \ntidak semata-mata mencari keuntungan. \n2. Pinjaman adalah penyediaan dana oleh LKM kepada \nmasyarakat yang harus dikembalikan sesuai dengan \nyang diperjanjikan. \n3. Pembiayaan adalah penyediaan dana oleh LKM kepada \nmasyarakat yang harus dikembalikan sesuai dengan \nyang diperjanjikan dengan prinsip syariah. \n4. Simpanan adalah dana yang dipercayakan oleh \nmasyarakat kepada LKM dalam bentuk tabungan \ndan/atau deposito berdasarkan perjanjian penyimpanan \ndana. \n5. Penyimpan adalah pihak yang menempatkan dananya \npada LKM berdasarkan perjanjian. \n6. Prinsip Syariah adalah ketentuan hukum Islam \nberdasarkan fatwa atau pernyataan kesesuaian syariah \ndari Dewan Syariah Nasional Majelis Ulama Indonesia  \n(DSN MUI). \n7. Direksi:', '-6- \n \na. 0% (nol perse n) dari Pinjaman atau Pembiayaan \ndengan kualitas lancar;   \nb. 50% (lima puluh perse n) dari Pinjaman atau \nPembiayaan dengan kualitas diragukan; dan \nc. 100% (seratus perse n) dari Pinjaman atau \nPembiayaan dengan kualitas macet. \nBagian Ketiga \nPengelolaan Simpanan \nPasal 10 \nDalam menjalankan kegiatan pengelolaan Simpanan \nsebagaimana dimaksud dalam Pasal 2 ayat (1), LKM wajib \nmengadministrasikan Simpanan Penyimpan dan \nmemberikan tanda bukti Simpanan.      \nPasal 11 \n(1)  LKM dilarang menolak batas nilai minimum untuk \nlayanan pembukaan Simpanan. \n(2) Batas nilai minimum sebagaimana dimaksud pada ayat \n(1) ditetapkan sebesar Rp5.000,- (lima ribu Rupiah). \nBAB III \nSUMBER PENDANAAN \nPasal 12 \n(1)  Sumber pendanaan LKM hanya dapat berasal dari: \na. ekuitas; \nb. Simpanan; \nc. pinjaman; dan/atau   \nd. hibah. \n(2) LKM dilarang menerima pinjaman sebagaimana \ndimaksud pada ayat (1) huruf c kecuali dari warga \nnegara Indonesia dan /atau badan usaha yang didirikan \ndan beroperasi di wilayah Republik Indonesia \nberdasarkan perjanjian pinjam meminjam. \n \n \n \n \n \nBAB IV...']","Sumber pendanaan LKM hanya dapat berasal dari ekuitas, Simpanan, pinjaman, dan/atau hibah.","Sumber pendanaan LKM hanya dapat berasal dari: ekuitas, Simpanan, pinjaman, dan/atau hibah.",1.0,1.0,0.3333333333,0.9993841927981405
Berapa nilai minimum layanan pembukaan Simpanan yang tidak boleh ditolak oleh Lembaga Keuangan Mikro (LKM)?,"['Pasal 21 \n(1) Perusahaan Pergadaian wajib memenuhi nilai \nminimum perbandingan antara Uang Pinjaman dan \nnilai taksiran Barang Jaminan dalam memberikan \nUang Pinjaman kepada Nasabah, kecuali apabila \nNasabah menyatakan secara tertulis menghendaki \nUang Pinjaman yang lebih rendah. \n(2) Ketentuan lebih lanjut mengenai nilai minimum \nperbandingan antara Uang Pinjaman dan nilai \ntaksiran Barang Jaminan sebagaimana dimaksud \npada ayat (1) diatur dalam Surat Edaran OJK.', '-6- \n \na. 0% (nol perse n) dari Pinjaman atau Pembiayaan \ndengan kualitas lancar;   \nb. 50% (lima puluh perse n) dari Pinjaman atau \nPembiayaan dengan kualitas diragukan; dan \nc. 100% (seratus perse n) dari Pinjaman atau \nPembiayaan dengan kualitas macet. \nBagian Ketiga \nPengelolaan Simpanan \nPasal 10 \nDalam menjalankan kegiatan pengelolaan Simpanan \nsebagaimana dimaksud dalam Pasal 2 ayat (1), LKM wajib \nmengadministrasikan Simpanan Penyimpan dan \nmemberikan tanda bukti Simpanan.      \nPasal 11 \n(1)  LKM dilarang menolak batas nilai minimum untuk \nlayanan pembukaan Simpanan. \n(2) Batas nilai minimum sebagaimana dimaksud pada ayat \n(1) ditetapkan sebesar Rp5.000,- (lima ribu Rupiah). \nBAB III \nSUMBER PENDANAAN \nPasal 12 \n(1)  Sumber pendanaan LKM hanya dapat berasal dari: \na. ekuitas; \nb. Simpanan; \nc. pinjaman; dan/atau   \nd. hibah. \n(2) LKM dilarang menerima pinjaman sebagaimana \ndimaksud pada ayat (1) huruf c kecuali dari warga \nnegara Indonesia dan /atau badan usaha yang didirikan \ndan beroperasi di wilayah Republik Indonesia \nberdasarkan perjanjian pinjam meminjam. \n \n \n \n \n \nBAB IV...', '-2- \n \n1. Lembaga Keuangan Mikro yang selanjutnya disingkat \nLKM adalah lembaga keuangan yang khusus didirikan \nuntuk memberikan jasa pengembangan usaha dan \npemberdayaan masyarakat, baik melalui pinjaman atau \npembiayaan dalam usaha skala mikro kepada anggota \ndan masyarakat, pengelolaa n simpanan, maupun \npemberian jasa konsultasi pengembangan usaha yang \ntidak semata-mata mencari keuntungan. \n2. Pinjaman adalah penyediaan dana oleh LKM kepada \nmasyarakat yang harus dikembalikan sesuai dengan \nyang diperjanjikan. \n3. Pembiayaan adalah penyediaan dan a oleh LKM kepada \nmasyarakat yang harus dikembalikan sesuai dengan \nyang diperjanjikan dengan prinsip syariah. \n4. Simpanan adalah dana yang dipercayakan oleh \nmasyarakat kepada LKM dalam bentuk tabungan \ndan/atau deposito berdasarkan perjanjian penyimpanan \ndana. \n5. Penyimpan adalah pihak yang menempatkan dananya \npada LKM berdasarkan perjanjian. \n6. Prinsip Syariah adalah ketentuan hukum Islam \nberdasarkan fatwa atau pernyataan kesesuaian syariah \ndari Dewan Syariah Nasional Majelis Ulama Indonesia  \n(DSN MUI). \n7. Direksi:']","Batas nilai minimum layanan pembukaan Simpanan yang tidak boleh ditolak oleh LKM adalah Rp5.000,- (lima ribu Rupiah).","Batas nilai minimum untuk layanan pembukaan Simpanan ditetapkan sebesar Rp5.000,- (lima ribu Rupiah).",1.0,1.0,0.49999999995,0.9885378716717965
Bagaimana pengelompokkan penilaian kualitas Pinjaman atau Pembiayaan di Lembaga Keuangan Mikro (LKM)?,"['Pasal 8 \n(1) LKM wajib melakukan penilaian kualitas Pinjaman atau \nPembiayaan yang disalurkan. \n(2) Penilaian kualitas Pinjaman atau Pembiayaan \nsebagaimana dimaksud pada ayat (1) ditetapkan menjadi \n3 (tiga) kelompok yaitu: \na. lancar; \nb. diragukan; dan \nc. macet. \n(3) Ketentuan mengenai parameter pengukuran kualitas \nPinjaman atau Pembiayaan  sebagaimana tercantum \ndalam Lampiran II I yang merupakan bagian yang tidak \nterpisahkan dari Peraturan OJK ini. \nPasal 9 \nLKM wajib membentuk penyisihan penghapusan Pinjaman \natau Pembiayaan paling kurang:  \na. 0%...', '-6- \n \na. 0% (nol perse n) dari Pinjaman atau Pembiayaan \ndengan kualitas lancar;   \nb. 50% (lima puluh perse n) dari Pinjaman atau \nPembiayaan dengan kualitas diragukan; dan \nc. 100% (seratus perse n) dari Pinjaman atau \nPembiayaan dengan kualitas macet. \nBagian Ketiga \nPengelolaan Simpanan \nPasal 10 \nDalam menjalankan kegiatan pengelolaan Simpanan \nsebagaimana dimaksud dalam Pasal 2 ayat (1), LKM wajib \nmengadministrasikan Simpanan Penyimpan dan \nmemberikan tanda bukti Simpanan.      \nPasal 11 \n(1)  LKM dilarang menolak batas nilai minimum untuk \nlayanan pembukaan Simpanan. \n(2) Batas nilai minimum sebagaimana dimaksud pada ayat \n(1) ditetapkan sebesar Rp5.000,- (lima ribu Rupiah). \nBAB III \nSUMBER PENDANAAN \nPasal 12 \n(1)  Sumber pendanaan LKM hanya dapat berasal dari: \na. ekuitas; \nb. Simpanan; \nc. pinjaman; dan/atau   \nd. hibah. \n(2) LKM dilarang menerima pinjaman sebagaimana \ndimaksud pada ayat (1) huruf c kecuali dari warga \nnegara Indonesia dan /atau badan usaha yang didirikan \ndan beroperasi di wilayah Republik Indonesia \nberdasarkan perjanjian pinjam meminjam. \n \n \n \n \n \nBAB IV...', 'BAB II \nKEGIATAN USAHA \nBagian Kesatu \nUmum \nPasal 2 \n(1) Kegiatan usaha LKM meliputi jasa pengembangan usaha \ndan pemberdayaan masyarakat, baik melalui Pinjaman \natau Pembiayaan dalam usaha skala mikro kepada \nanggota dan masyarakat, pengelolaan Simpanan, \nmaupun pemberian jasa konsultasi pengembangan \nusaha. \n(2) Kegiatan usaha sebagaimana dimaksud pada ayat (1) \ndapat dilakukan secara konvensional atau berdasarkan \nPrinsip Syariah. \nBagian Kedua \nPenyaluran Pinjaman atau Pembiayaan \nPasal 3 \n(1) Dalam menjalankan kegiatan usaha penyaluran \nPinjaman atau Pembiayaan sebagaimana dimaksud \ndalam Pasal 2 ayat (1), LKM wajib m elakukan analisis \natas kelayakan penyaluran Pinjaman atau Pembiayaan. \n(2) Penyaluran Pinjaman atau Pembiayaan sebagaimana \ndimaksud pada ayat (1) dilakukan dalam rangka \npengembangan usaha dan pemberdayaan masyarakat. \nPasal 4 \n(1) Dalam menjalankan kegiatan penyaluran Pinjaman atau \nPembiayaan kepada anggota atau masyarakat, LKM \nmenetapkan...']","Pengelompokkan penilaian kualitas Pinjaman atau Pembiayaan di LKM terdiri dari lancar, diragukan, dan macet.","Penilaian kualitas Pinjaman atau Pembiayaan ditetapkan menjadi 3 (tiga) kelompok yaitu: lancar, diragukan, dan macet.",1.0,1.0,0.99999999995,0.8400851749231423
