user_input,retrieved_contexts,response,reference,faithfulness,context_recall,context_precision,answer_correctness
Berapa persentase penyisihan penghapusan Pinjaman atau Pembiayaan yang wajib dibentuk LKM untuk kredit dengan kualitas diragukan?,"['-6- \n \na. 0% (nol perse n) dari Pinjaman atau Pembiayaan \ndengan kualitas lancar;   \nb. 50% (lima puluh perse n) dari Pinjaman atau \nPembiayaan dengan kualitas diragukan; dan \nc. 100% (seratus perse n) dari Pinjaman atau \nPembiayaan dengan kualitas macet. \nBagian Ketiga \nPengelolaan Simpanan \nPasal 10 \nDalam menjalankan kegiatan pengelolaan Simpanan \nsebagaimana dimaksud dalam Pasal 2 ayat (1), LKM wajib \nmengadministrasikan Simpanan Penyimpan dan \nmemberikan tanda bukti Simpanan.      \nPasal 11 \n(1)  LKM dilarang menolak batas nilai minimum untuk \nlayanan pembukaan Simpanan. \n(2) Batas nilai minimum sebagaimana dimaksud pada ayat \n(1) ditetapkan sebesar Rp5.000,- (lima ribu Rupiah). \nBAB III \nSUMBER PENDANAAN \nPasal 12 \n(1)  Sumber pendanaan LKM hanya dapat berasal dari: \na. ekuitas; \nb. Simpanan; \nc. pinjaman; dan/atau   \nd. hibah. \n(2) LKM dilarang menerima pinjaman sebagaimana \ndimaksud pada ayat (1) huruf c kecuali dari warga \nnegara Indonesia dan /atau badan usaha yang didirikan \ndan beroperasi di wilayah Republik Indonesia \nberdasarkan perjanjian pinjam meminjam. \n \n \n \n \n \nBAB IV...', 'Pasal 8 \n(1) LKM wajib melakukan penilaian kualitas Pinjaman atau \nPembiayaan yang disalurkan. \n(2) Penilaian kualitas Pinjaman atau Pembiayaan \nsebagaimana dimaksud pada ayat (1) ditetapkan menjadi \n3 (tiga) kelompok yaitu: \na. lancar; \nb. diragukan; dan \nc. macet. \n(3) Ketentuan mengenai parameter pengukuran kualitas \nPinjaman atau Pembiayaan  sebagaimana tercantum \ndalam Lampiran II I yang merupakan bagian yang tidak \nterpisahkan dari Peraturan OJK ini. \nPasal 9 \nLKM wajib membentuk penyisihan penghapusan Pinjaman \natau Pembiayaan paling kurang:  \na. 0%...', '(3) Pemeriksaan sebagaimana dimaksud pada Pasal 8 ayat \n(3) dilakukan dalam hal terdapat dugaan adanya \nkondisi-kondisi: \na. terjadinya penyalahgunaan keuangan LKM baik oleh \nDireksi, Komisaris maupun pegawai LKM; \nb. terjadinya kesulitan likuiditas dan solvabilitas yang \nmengarah pada kondisi yang membahayakan \nkeberlangsungan usaha LKM; \nc. terdapat penyimpangan terhadap Prinsip Syariah bagi \nLKM yang menyelenggarakan kegiatan usahanya \nberdasarkan Prinsip Syariah; \nd. tunggakan pengembalian Pinjaman atau Pembiayaan \ncukup besar sehingga dapat mempengaruhi kondisi \nkeuangan LKM; \ne. adanya penyimpangan dalam bent uk pemberian \nPinjaman atau Pembiayaan fiktif;  \nf. terjadinya kesalahan dalam pencatatan dan/atau \nperhitungan pembukuan yang berakibat kerugian \nfinansial bagi LKM; dan/atau \ng. terdapat kondisi -kondisi di luar ketentuan \nsebagaimana dimaksud huruf a sampai dengan huruf \nf, yang berdasarkan pertimbangan dari OJK perlu \nuntuk dilakukan Pemeriksaan secara langsung oleh \nOJK terhadap LKM. \n \n   (4) Dalam…']",50% (lima puluh persen) dari Pinjaman atau Pembiayaan dengan kualitas diragukan.,LKM wajib membentuk penyisihan penghapusan Pinjaman atau Pembiayaan paling kurang 50% (lima puluh persen) dari Pinjaman atau Pembiayaan dengan kualitas diragukan.,1.0,1.0,0.9999999999,0.7291851594747631
Apa saja bentuk badan hukum yang diizinkan untuk menyelenggarakan Usaha Pergadaian?,"['BAB II \nBENTUK BADAN HUKUM, KEPEMILIKAN,  \nDAN PERMODALAN \n \nPasal 2 \n(1) Bentuk badan hukum Perusahaan Pergadaian adalah: \na. perseroan terbatas; atau \nb. koperasi. \n(2) Perusahaan Pergadaian yang berbentuk badan hukum \nperseroan terbatas sebagaimana dimaksud pada ayat \n(1) huruf a, sahamnya hanya dapat dimiliki oleh: \na. negara Republik Indonesia; \nb. pemerintah daerah; \nc. warga negara Indonesia; dan/atau \nd. badan hukum Indonesia. \n(3) Ketentuan kepemilikan untuk Perusahaan Pergadaian \nyang berbentuk badan hukum koperasi sebagaimana \ndimaksud pada ayat (1) huruf b mengikuti  ketentuan', 'b. bukti perubahan bentuk badan hukum  yang telah disahkan oleh instansi \nyang berwenang; \nc. berita acara pengalihan seluruh hak dan kewajiban dari badan hukum lama \nkepada badan hukum baru; dan \nd. NPWP atas nama PT/Perum/Koperasi*) Penjaminan yang baru.  \n \nDemikian permohonan kami dan atas perhatian Bapak/lbu*), kami \nmengucapkan terima kasih.    \n \nDireksi \nPT/Perum/Koperasi*)    \nPenjaminan ..... \n \n \n \n \n                                                           …………………… \n \n*) Coret yang tidak perlu \n \n \n \n \nDitetapkan di Jakarta \n                                                              pada tanggal 7 April 2014 \n  \nKETUA DEWAN KOMISIONER \nOTORITAS JASA KEUANGAN \n  \nttd.         Ttd. \n    \nMULIAMAN D. HADAD \n \nSalinan sesuai dengan aslinya  \nKEPALA BAGIAN BANTUAN HUKUM  \nDIREKTORAT HUKUM,  \n \n            Ttd.  \n \nMUFLI ASMAWIDJAJA', 'Pasal 18 \n  (1) Direksi wajib melaporkan Perubahan bentuk badan \nhukum Lembaga Penjaminan secara tertulis kepada \nOtoritas Jasa Keuangan paling lambat 15 (lima \nbelas) hari sejak diperolehnya surat persetujuan \nperubahan bentuk badan hukum  dari instansi \nberwenang sesuai dengan format dalam Lampiran  \nVIII Peraturan Otoritas Jasa Keuangan  ini dan \ndilampiri dokumen:   \na. risalah rapat umum pemegang saham atau \nrapat anggota  mengenai perubahan bentuk \nbadan hukum Lembaga Penjaminan; \nb. bukti perubahan bentuk badan hukum  yang \ntelah disahkan oleh instansi yang berwenang; \nc. berita acara pengalihan seluruh hak dan \nkewajiban dari badan hukum lama kepada \nbadan hukum baru; dan \nd. NPWP atas nama Lembaga Penjaminan yang \nbaru. \n  (2) Berdasarkan laporan sebagaimana dimaksud pada \nayat (1), Otoritas Jasa Keuangan menetapkan \npencatatan perubahan bentuk badan hukum \nLembaga Penjaminan dengan keputusan Dewan \nKomisoner Otoritas Jasa Keuangan mengenai \nperubahan bentuk badan hukum Lembaga \nPenjaminan.']",Bentuk badan hukum yang diizinkan untuk Usaha Pergadaian adalah perseroan terbatas atau koperasi.,Bentuk badan hukum Perusahaan Pergadaian adalah perseroan terbatas atau koperasi.,1.0,1.0,0.9999999999,0.9945605577228632
Berapa Modal Disetor paling sedikit untuk mendirikan Perusahaan Pergadaian lingkup wilayah usaha kabupaten/kota?,"['Bagian Kesatu \nPerubahan Modal Disetor, Perubahan Alamat Kantor Pusat, \ndan Perubahan Nama Perusahaan Pergadaian \n \nPasal 32 \n(1) Perusahaan Pergadaian wajib melaporkan perubahan \nModal Disetor secara tertulis kepada OJK paling lama \n15 (lima belas) Hari setelah diterbitkannya persetujuan \natau surat penerimaan pemberitahuan dari instansi \nyang berwenang, atau disetujui oleh rapat anggota. \n(2) Pelaporan perubahan Modal Disetor sebagaimana \ndimaksud pada ayat (1) harus disampaikan oleh Direksi \nPerusahaan Pergadaian dengan menggunakan format 5 \nsebagaimana tercantum dalam Lampiran yang \nmerupakan bagian yang tidak terpisahkan dari \nPeraturan OJK ini dengan dilampiri dokumen: \na. perubahan anggaran dasar yang disertai dengan \nbukti persetujuan dari instansi berwenang bagi \nPerusahaan Pergadaian yang berbentuk badan \nhukum perseroan terbatas;  \nb. akta risalah rapat anggota dan/atau perubahan \nanggaran dasar bagi Perusahaan Pergadaian yang \nberbentuk badan hukum koperasi; dan \nc. surat pernyataan bahwa setoran modal tidak \nberasal dari pinjaman dan/atau tindak pidana \npencucian uang.', '- 6 - \n \nperaturan perundang -undangan di bidang \nperkoperasian. \n \nPasal 3 \nPerusahaan Pergadaian dilarang dimiliki baik secara \nlangsung maupun tidak langsung oleh warga negara asing \ndan/atau badan usaha yang sebagian atau seluruhnya \ndimiliki oleh warga negara asing atau badan usaha asing, \nkecuali kepemilikan langsung maupun tidak  langsung \ntersebut dilakukan melalui bursa efek.  \n \nPasal 4 \n(1) Modal Disetor Perusahaan Pergadaian ditetapkan \nberdasarkan lingkup wilayah usaha yaitu \nkabupaten/kota atau provinsi. \n(2) Jumlah Modal Disetor Perusahaan Pergadaian \nsebagaimana dimaksud pada ayat (1) ditetapkan \npaling sedikit: \na. Rp500.000.000,00 (lima ratus juta rupiah), untuk \nlingkup wilayah usaha kabupaten/kota; atau \nb. Rp2.500.000.000,00 (dua miliar lima ratus juta \nrupiah), untuk lingkup wilayah usaha provinsi. \n(3) Modal Disetor sebagaimana dimaksud pada ayat ( 2) \nharus disetor secara tunai dan penuh atas nama \nPerusahaan Pergadaian pada salah satu bank umum \natau bank umum syariah di Indonesia.', 'a. bagi Perusahaan Pergadaian  yang berbentuk \nbadan hukum perseroan terbatas ad alah modal \ndisetor sebagaimana dimaksud dalam Undang -\nUndang Nomor 40 Tahun 2007 tentang Perseroan \nTerbatas; atau \nb. bagi Perusahaan Pergadaian  yang berbentuk \nbadan hukum koperasi adalah simpanan pokok']","Modal Disetor paling sedikit untuk mendirikan Perusahaan Pergadaian lingkup wilayah usaha kabupaten/kota adalah Rp500.000.000,00 (lima ratus juta rupiah).","Jumlah Modal Disetor Perusahaan Pergadaian untuk lingkup wilayah usaha kabupaten/kota ditetapkan paling sedikit Rp500.000.000,00 (lima ratus juta rupiah).",1.0,1.0,0.49999999995,0.9956495082962906
Berapa bulan batas jangka waktu paling lama untuk pinjaman dengan jaminan berdasarkan hukum Gadai?,"['Pasal 24 \n(1) Jangka waktu pinjaman kepada Nasabah dengan \njaminan berdasarkan hukum Gadai paling lama 4 \n(empat) bulan. \n(2) Dalam hal Uang Pinjaman dengan jaminan \nberdasarkan hukum Gadai belum dilunasi sampai', '- 9 - \n \nbulan untuk periode yang berakhir pada tanggal 31 \nMaret, 30 Juni, 30 September, dan 31 Desember  \nkepada OJK dengan informasi yang paling sedikit \nmemuat: \na. jumlah Pemberi Pinjaman dan Penerima Pinjaman; \nb. kualitas pinjaman yang diterima oleh Penerima \nPinjaman berikut dasar penilaian kualitas \npinjaman; dan \nc. kegiatan yang telah dilakukan setelah terdaftar di \nOJK. \n(2) Laporan berkala setiap 3 (tiga) bulan  sebagaimana \ndimaksud pada ayat ( 1) disampaikan kepada OJK \npaling lambat 10 (sepuluh) hari kerja terhitung sejak \njatuh tempo tanggal pelaporan. \n \nPasal 10 \n(1) Penyelenggara yang telah terdaftar di OJK, wajib \nmengajukan permohonan izin sebagai Penyelenggara \ndalam jangka waktu paling lama 1 (satu) tahun sejak \ntanggal terdaftar di OJK. \n(2) Dalam hal jangka waktu sebagaimana dimaksud pada \nayat (1) telah berakhir , Penyelenggara yang telah \nmendapatkan surat tanda bukti terdaftar dan tidak \nmenyampaikan permohonan perizinan  atau tidak \nmemenuhi p ersyaratan perizinan, surat tanda bukti \nterdaftar Penyelenggara sebagaimana dimaksud dalam', '- 47 - \n \n(2) Peringatan sebagaimana dimaksud pada ayat (1) huruf \na diberikan paling banyak 3 (tiga) kali berturut-turut \ndengan jangka waktu paling lama masing-masing 40 \n(empat puluh) Hari. \n(3) Dalam hal sebelum berakhirnya jangka waktu sanksi \nperingatan sebagaimana dimaksud pada ayat (2), \nPerusahaan Pergadaian telah memenuhi ketentuan \nsebagaimana dimaksud pada ayat (1), OJK mencabut \nsanksi peringatan. \n(4) Dalam hal masa berlaku peringatan ketiga \nsebagaimana dimaksud pada ayat (2) berakhir dan \nPerusahaan Pergadaian tetap tidak memenuhi \nketentuan sebagaimana dimaksud pada ayat (1), OJK \nmengenakan sanksi pembekuan kegiatan usaha. \n(5) Sanksi pembekuan kegiatan usaha diberikan secara \ntertulis dan berlaku sejak ditetapkan untuk jangka \nwaktu paling lama 6 (enam) bulan. \n(6) Dalam hal sebelum berakhirnya jangka waktu \npembekuan kegiatan usaha sebagaimana dimaksud \npada ayat (5), Perusahaan Pergadaian telah memenuhi \nketentuan sebagaimana dimaksud pada ayat (1), OJK \nmencabut sanksi pembekuan kegiatan usaha.']",Jangka waktu pinjaman dengan jaminan berdasarkan hukum Gadai paling lama 4 (empat) bulan.,Jangka waktu pinjaman kepada Nasabah dengan jaminan berdasarkan hukum Gadai paling lama 4 (empat) bulan.,1.0,1.0,0.9999999999,0.9922519976089539
Berapa batas maksimum total pemberian pinjaman dana kepada setiap Penerima Pinjaman dalam Layanan Pinjam Meminjam Uang Berbasis Teknologi Informasi (Fintech)?,"['Bagian Ketiga \nBatasan Pemberian Pinjaman Dana \n \nPasal 6 \n(1) Penyelenggara wajib memenuhi ketentuan batas \nmaksimum total pemberian pinjaman dana k epada \nsetiap Penerima Pinjaman.', '- 7 - \n \n(2) Batas maksimum total pemberian pinjaman dana \nsebagaimana dimaksud pada ayat ( 1) ditetapkan \nsebesar Rp2.000.000.000,00 (dua miliar rupiah). \n(3) OJK dapat melakukan peninjauan kembali atas batas \nmaksimum total pemberian pinjaman d ana \nsebagaimana dimaksud pada ayat (2).', 'BAB XV \nKETENTUAN PENUTUP \n \nPasal 51 \nKetentuan lebih lanjut mengenai Layanan Pinjam Meminjam \nUang Berbasis Teknologi Informasi antar a lain terkait  \nperubahan batas maksimum total pemberian pinjaman \ndana, tata cara pemberian pinjaman, kerja sama antara \nPenyelenggara dengan penyelenggara layanan pendukung \nlainnya berbasis teknologi informasi , penempatan pusat \ndata dan standar minimum  sistem teknologi informasi, \npengelolaan risiko teknologi informasi, pengamanan \nteknologi informasi,  ketahanan terhadap gangguan dan \nkegagalan sistem serta alih kelola sistem teknologi \ninformasi, sistem keamanan, kerahasiaan data, kegagalan \nsistem transaksi Penyelenggara, pengamanan sistem \nteknologi informasi, pengelolaan celah keamanan teknologi']","Batas maksimum total pemberian pinjaman dana kepada setiap Penerima Pinjaman adalah Rp2.000.000.000,00 (dua miliar rupiah).","Batas maksimum total pemberian pinjaman dana kepada setiap Penerima Pinjaman ditetapkan sebesar Rp2.000.000.000,00 (dua miliar rupiah).",1.0,1.0,0.49999999995,0.997839188392963
Berapa maksimal kepemilikan saham oleh warga negara asing atau badan hukum asing pada penyelenggara Fintech P2P Lending?,"['- 6 - \n \nperaturan perundang -undangan di bidang \nperkoperasian. \n \nPasal 3 \nPerusahaan Pergadaian dilarang dimiliki baik secara \nlangsung maupun tidak langsung oleh warga negara asing \ndan/atau badan usaha yang sebagian atau seluruhnya \ndimiliki oleh warga negara asing atau badan usaha asing, \nkecuali kepemilikan langsung maupun tidak  langsung \ntersebut dilakukan melalui bursa efek.  \n \nPasal 4 \n(1) Modal Disetor Perusahaan Pergadaian ditetapkan \nberdasarkan lingkup wilayah usaha yaitu \nkabupaten/kota atau provinsi. \n(2) Jumlah Modal Disetor Perusahaan Pergadaian \nsebagaimana dimaksud pada ayat (1) ditetapkan \npaling sedikit: \na. Rp500.000.000,00 (lima ratus juta rupiah), untuk \nlingkup wilayah usaha kabupaten/kota; atau \nb. Rp2.500.000.000,00 (dua miliar lima ratus juta \nrupiah), untuk lingkup wilayah usaha provinsi. \n(3) Modal Disetor sebagaimana dimaksud pada ayat ( 2) \nharus disetor secara tunai dan penuh atas nama \nPerusahaan Pergadaian pada salah satu bank umum \natau bank umum syariah di Indonesia.', '-10- \n \n   \n(3) Badan usaha asing sebagaimana dimaksud pada \nayat (2) huruf c hanya dapat memiliki saham pada \nLembaga Penjaminan berbentuk badan hukum \nPerseroan Terbatas.  \n  (4) Total kepemilikan asing pada Lembaga Penjaminan \nberbentuk badan hukum Perseroan Terbatas baik \nsecara langsung maupun tidak langsung paling \nbanyak sebesar 49% (empat puluh sembilan per \nseratus) dari modal disetor. \n  (5) Perusahaan Penjaminan Ulang  atau Perusahaan \nPenjaminan Ulang  Syariah yang berbentuk badan \nhukum Koperasi hanya dapat dimiliki oleh \ngabungan Perusahaan Penjaminan  atau \nPerusahaan Penjaminan Syariah  yang berbentuk \nbadan hukum Koperasi. \n  BAB III \n  KEPEMILIKAN DAN KEPENGURUSAN \n  Pasal 8 \n  (1) Bagi pemegang saham yang berbentuk badan \nhukum Indonesia, jumlah penyertaan modal pada \nLembaga Penjaminan ditetapkan paling banyak  \nsebesar: \na. ekuitas badan hukum  yang bersangkutan \napabila tidak terdapat penyertaan lain; atau \nb. ekuitas badan hukum yang bersangkutan \ndikurangi jumlah penyertaan lain yang telah \ndilakukan apabila terdapat penyertaan lain.', '- 5 - \n \n15. Tanda Tangan Elektronik adalah tanda tangan yang \nterdiri atas informasi elektronik yang dilekatkan, \nterasosiasi atau terkait dengan informasi elektronik \nlainnya yang digunakan sebagai alat verifikasi dan \nautentikasi sebagaimana dimaksud dalam Undang -\nUndang Nomor 11 Tahun 2008 tentang Informasi dan \nTransaksi Elektronik. \n \nBAB II \nPENYELENGGARA LAYANAN PINJAM MEMINJAM UANG \nBERBASIS TEKNOLOGI INFORMASI  \n \nBagian Kesatu \nBentuk Badan Hukum, Kepemilikan, dan Permodalan \n \nPasal 2 \n(1) Penyelenggara dinyatakan sebagai Lembaga Jasa \nKeuangan Lainnya. \n(2) Badan hukum Penyelenggara berbentuk: \na. perseroan terbatas; atau \nb. koperasi. \n \nPasal 3 \n(1) Penyelenggara berbentuk badan hukum perseroan \nterbatas sebagaimana dimaksud dalam Pasal 2 ayat (2) \nhuruf a, dapat didirikan dan dimiliki oleh: \na. warga negara Indonesia  dan/atau badan hukum \nIndonesia; dan/atau \nb. warga negara asing dan/atau badan hukum asing. \n(2) Kepemilikan saham Penyelenggara oleh warga negara \nasing dan/atau badan hukum asing sebagaimana \ndimaksud pada ayat (1) huruf b, baik secara langsung \nmaupun tidak langsung paling banyak  85% (delapan \npuluh lima persen).']",Maksimal kepemilikan saham oleh warga negara asing atau badan hukum asing pada penyelenggara Fintech P2P Lending adalah 85%.,"Kepemilikan saham Penyelenggara oleh warga negara asing dan/atau badan hukum asing, baik secara langsung maupun tidak langsung paling banyak 85% (delapan puluh lima persen).",1.0,1.0,0.3333333333,0.7305778647384567
Apa syarat nilai transaksi tunai yang mewajibkan Penyedia Jasa Keuangan untuk melakukan prosedur Uji Tuntas Nasabah (Customer Due Diligence)?,"['c. memastikan adanya sistem yang dapat mengidentifikasi, \nmenganalisa, memantau dan menyediakan laporan secara \nefektif mengenai karakteristik transaksi yang dilakukan \noleh Nasabah; \nd. memastikan bahwa kebijakan dan prosedur yang disusun \nsebagaimana dimaksud dalam huruf b telah sesuai dengan \nperubahan dan perkembangan yang meliputi antara lain \nproduk, jasa, dan teknologi di sektor jasa keuangan, \nkegiatan dan kompleksitas usaha PJK, volume transaksi \nPJK, dan modus Pencucian Uang dan/atau Pendanaan \nTerorisme; \ne. memastikan bahwa formulir yang berkaitan dengan \nNasabah telah mengakomodasi data yang diperlukan \ndalam penerapan program APU dan PPT;  \nf. memantau rekening Nasabah dan pelaksanaan transaksi  \nNasabah; \ng. melakukan evaluasi terhadap hasil pemantauan dan \nanalisis transaksi Nasabah untuk memastikan ada atau \ntidak adanya Transaksi Keuangan Mencurigakan,', 'selanjutnya disingkat EDD adalah tindakan CDD lebih \nmendalam yang dilakukan PJK  terhadap Calon Nasabah, \nWIC, atau Nasabah, yang berisiko tinggi termasuk PEP \ndan/atau dalam area berisiko tinggi.  \n13. Nasabah Berisiko Tinggi ( High Risk Customers ) adalah \nNasabah yang berdasarkan latar belakang, identitas dan \nriwayatnya dianggap memiliki ris iko tinggi melakukan \nkegiatan terkait tindak pidana Pencucian Uang dan/atau \nPendanaan Terorisme. \n14. Transaksi Keuangan Mencurigakan adalah transaksi \nkeuangan mencurigakan sebagaimana dimaksud dalam \nUndang-Undang yang mengatur mengenai pencegahan \ndan pemberant asan tindak pidana Pencucian Uang dan \nUndang-Undang yang mengatur mengenai pencegahan \ndan pemberantasan tindak pidana Pendanaan Terorisme. \n15. Transaksi Keuangan Tunai adalah transaksi keuangan \ntunai sebagaimana dimaksud dalam Undang-Undang yang', '- 18 - \n \nPasal 15 \nPJK wajib melakukan prosedur CDD pada saat: \na. melakukan hubungan usaha dengan Calon Nasabah;  \nb. terdapat transaksi keuangan dengan mata uang rupiah \ndan/atau mata uang asing yang nilainya paling sedikit \natau setara dengan Rp100.000.000,00 (seratus juta \nrupiah); \nc. terdapat transaksi Transfer Dana sebagaimana dimaksud \ndalam Peraturan OJK ini; \nd. terdapat indikasi Transaksi Keuangan Mencurigakan yang \nterkait dengan Pencucian Uang dan/atau Pendanaan \nTerorisme; atau \ne. PJK meragukan kebenaran informasi yang diberikan oleh \nCalon Nasabah, Nasabah, penerima kuasa, dan/atau \nPemilik Manfaat (Beneficial Owner).']","Transaksi keuangan dengan mata uang rupiah dan/atau mata uang asing yang nilainya paling sedikit atau setara dengan Rp100.000.000,00 (seratus juta rupiah).","Prosedur CDD wajib dilakukan saat terdapat transaksi keuangan dengan mata uang rupiah dan/atau mata uang asing yang nilainya paling sedikit atau setara dengan Rp100.000.000,00 (seratus juta rupiah).",1.0,1.0,0.3333333333,0.9845990992570381
Apa pengertian Walk in Customer (WIC) dalam Peraturan Penerapan Program Anti Pencucian Uang di Sektor Jasa Keuangan?,"['d.  bahwa berdasarkan pertimbangan sebagaimana dimaksud \ndalam huruf a, huruf b, dan huruf c, perlu menetapkan \nPeraturan Otoritas Jasa Keuangan tentang Penerapan \nProgram Anti Pencucian Uang dan Pencegahan Pendanaan \nTerorisme di Sektor Jasa Keuangan; \n \nMengingat : 1.  Undang-Undang Nomor 8 Tahun 2010 tentang \nPencegahan dan Pemberantasan Tindak Pidana Pencucian \nUang (Lembaran Negara Republik Indonesia Tahun 2010 \nNomor 122, Tambahan Lembaran Negara Republik \nIndonesia Nomor 5164); \n  2.  Undang-Undang Nomor 21 Tahun 2011 tentang Otoritas \nJasa Keuangan (Lembaran Negara Republik Indonesia \nTahun 2011 Nomor 111, Tambahan Lembaran Negara \nRepublik Indonesia Nomor 5253);  \n  3.  Undang-Undang Nomor 9 Tahun 2013 tentang \nPencegahan dan Pemberantasan Tindak P idana \nPendanaan Terorisme (Lembaran Negara Republik \nIndonesia Tahun 2013 Nomor 50, Tambahan Lembaran \nNegara Republik Indonesia Nomor 5406); \n \nMEMUTUSKAN: \nMenetapkan : PERATURAN OTORITAS JASA KEUANGAN TENTANG \nPENERAPAN PROGRAM ANTI PENCUCIAN UANG DAN \nPENCEGAHAN PENDANAAN TERORISME DI SEKTOR JASA \nKEUANGAN.', '- 57 - \n \nb. Peraturan Bank Indonesia Nomor 14/27/PBI/2012 \ntentang Penerapan Program Anti Pencucian Uang dan \nPencegahan Pendanaan Terorisme bagi Bank U mum \n(Lembaran Negara Republik Indonesia Tahun 2012 Nomor \n290, Tambahan Lembaran Negara Republik Indonesia \nNomor 5385);  \nc. Peraturan OJK Nomor 22/POJK.04/2014 tentang Prinsip \nMengenal Nasabah oleh Penyedia Jasa Keuangan di Sektor \nPasar Modal (Lembaran Negara Republik Indonesia Tahun \n2014 Nomor 353, Tambahan Lembaran Negara Republik \nIndonesia Nomor 5631); dan \nd. Peraturan OJK Nomor 39/POJK.05/2015 tentang \nPenerapan program Anti Pencucian Uang dan Pencegahan \nPendanaan Terorisme oleh Penyedia Jasa Keuangan di \nSektor Industri Keuangan Non -Bank (Lembaran Negara \nRepublik Indonesia Tahun 2015 Nomor 320, Tambahan \nLembaran Negara Republik Indonesia Nomor 5790), \ndicabut dan dinyatakan tidak berlaku. \n  \nPasal 70 \nPeraturan OJK ini mulai berlaku pada tanggal diundangkan.', '- 3 - \n \nmengatur mengenai pencegahan dan pemberantasan \ntindak pidana Pendanaan Terorisme. \n8. Calon Nasabah adalah pihak yang akan menggunakan \njasa PJK.  \n9. Nasabah adalah pihak yang menggunakan jasa PJK. \n10. Walk in Customer  yang untuk selanjutnya disingkat WIC \nadalah pihak yang menggunakan jasa PJK di Sektor \nPerbankan atau PJK di Sektor Pasar Modal namun tidak \nmemiliki rekening pada PJK di Sektor Perbankan atau PJK \ndi Sektor Pasar Modal tersebut, tidak termasuk pihak yang \nmendapatkan perintah atau penugasan dari Nasabah \nuntuk melakukan transaksi atas kepentingan Nasabah.  \n11. Uji Tuntas Nasabah ( Customer Due Diligence ) yang \nselanjutnya disingkat CDD adalah kegiatan berupa \nidentifikasi, verifikasi, dan pemantauan yang dilakukan \noleh PJK untuk memastikan transaksi sesuai dengan \nprofil, karakteristik, dan/atau pola transaksi Calon \nNasabah, Nasabah, atau WIC. \n12. Uji Tuntas Lanjut ( Enhanced Due Diligence ) yang \nselanjutnya disingkat EDD adalah tindakan CDD lebih \nmendalam yang dilakukan PJK  terhadap Calon Nasabah, \nWIC, atau Nasabah, yang berisiko tinggi termasuk PEP \ndan/atau dalam area berisiko tinggi.']","Walk in Customer (WIC) adalah pihak yang menggunakan jasa PJK di Sektor Perbankan atau PJK di Sektor Pasar Modal namun tidak memiliki rekening pada PJK di Sektor Perbankan atau PJK di Sektor Pasar Modal tersebut, tidak termasuk pihak yang mendapatkan perintah atau penugasan dari Nasabah untuk melakukan transaksi atas kepentingan Nasabah.","Walk in Customer (WIC) adalah pihak yang menggunakan jasa PJK di Sektor Perbankan atau Pasar Modal namun tidak memiliki rekening pada PJK tersebut, tidak termasuk pihak yang mendapat perintah atau penugasan dari Nasabah untuk transaksi kepentingan Nasabah.",1.0,1.0,0.3333333333,0.9418361217668436
